The Elegant Universe,Brian Greene,9780099289920.0,009928992X,464,4.08,93004,1999-02-01,,,The Elegant Universe,Standalone,1,https://www.goodreads.com/book/show/8049273,"Brian Greene, one of the world's leading string theorists, peels away the layers of mystery surrounding string theory to reveal a universe that consists of eleven dimensions, where the fabric of space tears and repairs itself, and all matter, from the smallest quarks to the most gargantuan supernovas, is generated by the vibrations of microscopically tiny loops of energy.
Today, physicists and mathematicians throughout the world are feverishly working on one of the most ambitious theories ever proposed: superstring theory. String theory, as it is often called, is the key to the Unified Field Theory that eluded Einstein for more than thirty years. Finally, the century-old antagonism between the large and the small--General Relativity and Quantum Theory--is resolved. String theory proclaims that all of the wondrous happenings in the universe, from the frantic dancing of subatomic quarks to the majestic swirling of heavenly galaxies, are reflections of one grand physical principle and manifestations of one single entity: microscopically tiny vibrating loops of energy, a billionth of a billionth the size of an atom. In this brilliantly articulated and refreshingly clear book, Greene relates the scientific story and the human struggle behind twentieth-century physics' search for a theory of everything.
Through the masterful use of metaphor and analogy, The Elegant Universe makes some of the most sophisticated concepts ever contemplated viscerally accessible and thoroughly entertaining, bringing us closer than ever to understanding how the universe works.","['Science', 'Nonfiction', 'Science', 'Physics', 'Science', 'Astronomy']",https://i.gr-assets.com/images/S/compressed.photo.goodreads.com/books/1348791881l/8049273.jpg,"{'1x': [], '1.5x': [], '2x': [], '2.5x': [], '3x': [], '3.5x': [], '4x': []}",[],W. W. Norton & Company
In Search of Schrödinger's Cat: Quantum Physics and Reality,John Gribbin,,,400,4.05,19699,1984-09-01,,,In Search of Schrödinger's Cat: Quantum Physics and Reality,Standalone,1,https://www.goodreads.com/book/show/513367,"It is so shocking that Einstein could not bring himself to accept it. It is so important that it provides the fundamental underpinning of all modern sciences. Without it, we'd have no nuclear power or nuclear bombs, no lasers, no TV, no computers, no science of molecular biology, no understanding of DNA, no genetic engineering—at all.
John Gribbin tells the complete story of quantum mechanics, a truth far stranger than any fiction. He takes us step-by-step into an ever more bizarre and fascinating place—requiring only that we approach it with an open mind. He introduces the scientists who developed quantum theory. He investigates the atom, radiation, time travel, the birth of the universe, superconductors and life itself. And in a world full of its own delights, mysteries and surprises, he searches for Schrödinger's Cat—a search for quantum reality—as he brings every reader to a clear understanding of the most important area of scientific study today—quantum physics.","['Science', 'Nonfiction', 'Science', 'Physics', 'Science', 'Popular Science']",https://i.gr-assets.com/images/S/compressed.photo.goodreads.com/books/1440464162l/513367._SY475_.jpg,"{'1x': ['https://m.media-amazon.com/images/I/91yG9UjCPAL._AC_UY218_.jpg', 'https://m.media-amazon.com/images/I/91yG9UjCPAL._AC_UY654_FMwebp_QL65_.jpg', 'https://m.media-amazon.com/images/I/81nAyMKmNNL._AC_UY545_FMwebp_QL65_.jpg'], '1.5x': ['https://m.media-amazon.com/images/I/91yG9UjCPAL._AC_UY327_FMwebp_QL65_.jpg', 'https://m.media-amazon.com/images/I/81nAyMKmNNL._AC_UY218_.jpg', 'https://m.media-amazon.com/images/I/81nAyMKmNNL._AC_UY654_FMwebp_QL65_.jpg'], '2x': ['https://m.media-amazon.com/images/I/91yG9UjCPAL._AC_UY436_FMwebp_QL65_.jpg', 'https://m.media-amazon.com/images/I/81nAyMKmNNL._AC_UY327_FMwebp_QL65_.jpg', 'https://m.media-amazon.com/images/I/51DWeJFTz9L._AC_UY218_.jpg'], '2.5x': ['https://m.media-amazon.com/images/I/91yG9UjCPAL._AC_UY545_FMwebp_QL65_.jpg', 'https://m.media-amazon.com/images/I/81nAyMKmNNL._AC_UY436_FMwebp_QL65_.jpg'], '3x': [], '3.5x': [], '4x': []}","['https://images-na.ssl-images-amazon.com/images/I/91yG9UjCPAL.jpg', 'https://images-na.ssl-images-amazon.com/images/I/81nAyMKmNNL.jpg', 'https://images-na.ssl-images-amazon.com/images/I/51DWeJFTz9L.jpg']",
David Copperfield,Charles Dickens,9788175994287.0,8175994282,924,4.01,216898,1850-11-01,,,David Copperfield,Standalone,1,https://www.goodreads.com/book/show/58696,"David Copperfield is the story of a young man's adventures on his journey from an unhappy and impoverished childhood to the discovery of his vocation as a successful novelist. Among the gloriously vivid cast of characters he encounters are his tyrannical stepfather, Mr Murdstone; his brilliant, but ultimately unworthy school-friend James Steerforth; his formidable aunt, Betsey Trotwood; the eternally humble, yet treacherous Uriah Heep; frivolous, enchanting Dora Spenlow; and the magnificently impecunious Wilkins Micawber, one of literature's great comic creations. In David Copperfield - the novel he described as his 'favourite child' - Dickens drew revealingly on his own experiences to create one of the most exuberant and enduringly popular works, filled with tragedy and comedy in equal measure. This edition uses the text of the first volume publication of 1850, and includes updated suggestions for further reading, original illustrations by 'Phiz', a revised chronology and expanded notes. In his new introduction, Jeremy Tambling discusses the novel's autobiographical elements, and its central themes of memory and identity.","['Classics', 'Fiction', 'Literature', 'Historical', 'Historical Fiction', 'Literature']",https://i.gr-assets.com/images/S/compressed.photo.goodreads.com/books/1461452762l/58696._SY475_.jpg,"{'1x': ['https://m.media-amazon.com/images/I/91X1tT97wpL._AC_UY218_.jpg', 'https://m.media-amazon.com/images/I/91X1tT97wpL._AC_UY654_FMwebp_QL65_.jpg', 'https://m.media-amazon.com/images/I/91GHDN44ZQL._AC_UY545_FMwebp_QL65_.jpg'], '1.5x': ['https://m.media-amazon.com/images/I/91X1tT97wpL._AC_UY327_FMwebp_QL65_.jpg', 'https://m.media-amazon.com/images/I/91GHDN44ZQL._AC_UY218_.jpg', 'https://m.media-amazon.com/images/I/91GHDN44ZQL._AC_UY654_FMwebp_QL65_.jpg'], '2x': ['https://m.media-amazon.com/images/I/91X1tT97wpL._AC_UY436_FMwebp_QL65_.jpg', 'https://m.media-amazon.com/images/I/91GHDN44ZQL._AC_UY327_FMwebp_QL65_.jpg', 'https://m.media-amazon.com/images/I/81qkqzwdmTS._AC_UY218_.jpg'], '2.5x': ['https://m.media-amazon.com/images/I/91X1tT97wpL._AC_UY545_FMwebp_QL65_.jpg', 'https://m.media-amazon.com/images/I/91GHDN44ZQL._AC_UY436_FMwebp_QL65_.jpg', 'https://m.media-amazon.com/images/I/81qkqzwdmTS._AC_UY327_FMwebp_QL65_.jpg'], '3x': [], '3.5x': [], '4x': []}","['https://images-na.ssl-images-amazon.com/images/I/91X1tT97wpL.jpg', 'https://images-na.ssl-images-amazon.com/images/I/81CMpHb1wOL.jpg', 'https://images-na.ssl-images-amazon.com/images/I/81dpxm3do3L.jpg', 'https://images-na.ssl-images-amazon.com/images/I/81i4x5nKX+L.jpg', 'https://images-na.ssl-images-amazon.com/images/I/81P2wgvKAJL.jpg', 'https://images-na.ssl-images-amazon.com/images/I/91k6JRkGi-L.jpg', 'https://images-na.ssl-images-amazon.com/images/I/91IgXSZEwUL.jpg', 'https://images-na.ssl-images-amazon.com/images/I/81DaaqQCatL.jpg', 'https://images-na.ssl-images-amazon.com/images/I/81BkLiMsgYL.jpg', 'https://images-na.ssl-images-amazon.com/images/I/91GHDN44ZQL.jpg', 'https://images-na.ssl-images-amazon.com/images/I/51NHYEA-vZL.jpg', 'https://images-na.ssl-images-amazon.com/images/I/51I0hS6Ey5L.jpg', 'https://images-na.ssl-images-amazon.com/images/I/81Z2aKn-0TL.jpg', 'https://images-na.ssl-images-amazon.com/images/I/51RH6W5WsVL.jpg', 'https://images-na.ssl-images-amazon.com/images/I/81qkqzwdmTS.jpg', 'https://images-na.ssl-images-amazon.com/images/I/91sgdazBsNS.jpg', 'https://images-na.ssl-images-amazon.com/images/I/815l0PC76fS.jpg', 'https://images-na.ssl-images-amazon.com/images/I/81RrLfM+koS.jpg', 'https://images-na.ssl-images-amazon.com/images/I/81JH+K55R+S.jpg', 'https://images-na.ssl-images-amazon.com/images/I/81g3XppKu7S.jpg', 'https://images-na.ssl-images-amazon.com/images/I/81JqpliNO4S.jpg']",Penguin
Flatland: A Romance of Many Dimensions,Edwin A. Abbott,9780486272634.0,048627263X,96,3.81,63933,1884-01-01,,,Flatland: A Romance of Many Dimensions,Standalone,1,https://www.goodreads.com/book/show/433567,"This masterpiece of science (and mathematical) fiction is a delightfully unique and highly entertaining satire that has charmed readers for more than 100 years. The work of English clergyman, educator and Shakespearean scholar Edwin A. Abbott (1838-1926), it describes the journeys of A. Square [sic – ed.], a mathematician and resident of the two-dimensional Flatland, where women-thin, straight lines-are the lowliest of shapes, and where men may have any number of sides, depending on their social status.
Through strange occurrences that bring him into contact with a host of geometric forms, Square has adventures in Spaceland (three dimensions), Lineland (one dimension) and Pointland (no dimensions) and ultimately entertains thoughts of visiting a land of four dimensions—a revolutionary idea for which he is returned to his two-dimensional world. Charmingly illustrated by the author, Flatland is not only fascinating reading, it is still a first-rate fictional introduction to the concept of the multiple dimensions of space. ""Instructive, entertaining, and stimulating to the imagination."" — Mathematics Teacher.","['Fiction', 'Science Fiction', 'Classics', 'Science', 'Mathematics', 'Fantasy']",https://i.gr-assets.com/images/S/compressed.photo.goodreads.com/books/1435435775l/433567.jpg,"{'1x': [], '1.5x': [], '2x': [], '2.5x': [], '3x': [], '3.5x': [], '4x': []}",[],"Dover Publications, Inc."
The Mill on the Floss,George Eliot,9788175993839.0,8175993839,560,3.81,51484,1860-01-01,,,The Mill on the Floss,Standalone,1,https://www.goodreads.com/book/show/20564,"'If life had no love in it, what else was there for Maggie?'
Brought up at Dorlcote Mill, Maggie Tulliver worships her brother Tom and is desperate to win the approval of her parents, but her passionate, wayward nature and her fierce intelligence bring her into constant conflict with her family. As she reaches adulthood, the clash between their expectations and her desires is painfully played out as she finds herself torn between her relationships with three very different men: her proud and stubborn brother, a close friend who is also the son of her family's worst enemy, and a charismatic but dangerous suitor. With its poignant portrayal of sibling relationships, The Mill on the Floss is considered George Eliot's most autobiographical novel; it is also one of her most powerful and moving.
In this edition writer and critic A.S. Byatt provides full explanatory notes and an introduction relating Mill on the Floss to George Eliot's own life and times.
Edited with an introduction and notes by A.S. BYATT","['Classics', 'Fiction', 'Literature', '19th Century', 'Literature', 'Historical']",https://i.gr-assets.com/images/S/compressed.photo.goodreads.com/books/1628463066l/20564._SY475_.jpg,"{'1x': ['https://m.media-amazon.com/images/I/81fS1eNDn+S._AC_UY218_.jpg'], '1.5x': ['https://m.media-amazon.com/images/I/81fS1eNDn+S._AC_UY327_FMwebp_QL65_.jpg'], '2x': ['https://m.media-amazon.com/images/I/81fS1eNDn+S._AC_UY436_FMwebp_QL65_.jpg'], '2.5x': ['https://m.media-amazon.com/images/I/81fS1eNDn+S._AC_UY545_FMwebp_QL65_.jpg'], '3x': [], '3.5x': [], '4x': []}","['https://images-na.ssl-images-amazon.com/images/I/81fS1eNDn+S.jpg', 'https://images-na.ssl-images-amazon.com/images/I/81PEvvjlw6S.jpg', 'https://images-na.ssl-images-amazon.com/images/I/81QHCJ4LT7S.jpg', 'https://images-na.ssl-images-amazon.com/images/I/81xIdIeN5ZS.jpg', 'https://images-na.ssl-images-amazon.com/images/I/81-KPwMImwS.jpg', 'https://images-na.ssl-images-amazon.com/images/I/81RF3lloR3S.jpg', 'https://images-na.ssl-images-amazon.com/images/I/91c-D26SndS.jpg']",Penguin Classics
"The Throne of Fire (Kane Chronicles, #2)",Rick Riordan,9781423142010.0,1423142012,452,4.19,188989,2011-05-03,,,The Throne of Fire,Kane Chronicles,2,https://www.goodreads.com/book/show/9067850,"Ever since the gods of Ancient Egypt were unleashed in the modern world, Carter Kane and his sister Sadie have been in trouble. As descendants of the House of Life, the Kanes have some powers at their command, but the devious gods haven't given them much time to master their skills at Brooklyn House, which has become a training ground for young magicians.
And now their most threatening enemy yet - the chaos snake Apophis - is rising. If they don't prevent him from breaking free in a few days' time, the world will come to an end. In other words, it's a typical week for the Kane family.
To have any chance of battling the Forces of Chaos, the Kanes must revive the sun god Ra. But that would be a feat more powerful than any magician has ever accomplished.
First they have to search the world for the three sections of the Book of Ra, then they have to learn how to chant its spells. Oh, and did we mention that no one knows where Ra is exactly?
Narrated in two different wisecracking voices, featuring a large cast of new and unforgettable characters, and with adventures spanning the globe, this second installment in the Kane Chronicles is nothing short of a thrill ride.","['Fantasy', 'Fantasy', 'Mythology', 'Young Adult', 'Childrens', 'Middle Grade']",https://i.gr-assets.com/images/S/compressed.photo.goodreads.com/books/1366227973l/9067850.jpg,"{'1x': ['https://m.media-amazon.com/images/I/91tJAt3Yk7L._AC_UY218_.jpg', 'https://m.media-amazon.com/images/I/91tJAt3Yk7L._AC_UY654_FMwebp_QL65_.jpg'], '1.5x': ['https://m.media-amazon.com/images/I/91tJAt3Yk7L._AC_UY327_FMwebp_QL65_.jpg', 'https://m.media-amazon.com/images/I/9163d-sNrXL._AC_UY218_.jpg'], '2x': ['https://m.media-amazon.com/images/I/91tJAt3Yk7L._AC_UY436_FMwebp_QL65_.jpg', 'https://m.media-amazon.com/images/I/9163d-sNrXL._AC_UY327_FMwebp_QL65_.jpg'], '2.5x': ['https://m.media-amazon.com/images/I/91tJAt3Yk7L._AC_UY545_FMwebp_QL65_.jpg', 'https://m.media-amazon.com/images/I/9163d-sNrXL._AC_UY436_FMwebp_QL65_.jpg'], '3x': [], '3.5x': [], '4x': []}","['https://images-na.ssl-images-amazon.com/images/I/91tJAt3Yk7L.jpg', 'https://images-na.ssl-images-amazon.com/images/I/9163d-sNrXL.jpg']",Hyperion Books for Children
Murder on the Orient Express,Agatha Christie,,,289,4.19,497840,1934-01-01,,,Murder on the Orient Express,Standalone,1,https://www.goodreads.com/book/show/853510,"Just after midnight, a snowdrift stops the famous Orient Express in its tracks as it travels through the mountainous Balkans. The luxurious train is surprisingly full for the time of the year but, by the morning, it is one passenger fewer. An American tycoon lies dead in his compartment, stabbed a dozen times, his door locked from the inside.
One of the passengers is none other than detective Hercule Poirot. On vacation.
Isolated and with a killer on board, Poirot must identify the murderer—in case he or she decides to strike again.
Librarian's note: the first fifteen novels in the Hercule Poirot series are 1) The Mysterious Affair at Styles, 1920; 2) The Murder on the Links, 1923; 3) The Murder of Roger Ackroyd, 1926; 4) The Big Four, 1927; 5) The Mystery of the Blue Train, 1928; 6) Peril at End House, 1932; 7) Lord Edgware Dies, 1933; 8) Murder on the Orient Express, 1934; 9) Three Act Tragedy, 1935; 10) Death in the Clouds, 1935; 11) The A.B.C. Murders, 1936; 12) Murder in Mesopotamia, 1936; 13) Cards on the Table, 1936; 14) Dumb Witness, 1937; and 15) Death on the Nile, 1937. These are just the novels; Poirot also appears in this period in a play, Black Coffee, 1930, and two collections of short stories, Poirot Investigates, 1924, and Murder in the Mews, 1937. Each novel, play and short story has its own entry on Goodreads.","['Mystery', 'Classics', 'Fiction', 'Mystery', 'Crime', 'Thriller']",https://i.gr-assets.com/images/S/compressed.photo.goodreads.com/books/1486131451l/853510._SY475_.jpg,"{'1x': ['https://m.media-amazon.com/images/I/81YVXgvXoAL._AC_UY218_.jpg', 'https://m.media-amazon.com/images/I/81YVXgvXoAL._AC_UY654_FMwebp_QL65_.jpg', 'https://m.media-amazon.com/images/I/81u6pPXJ0xL._AC_UY545_FMwebp_QL65_.jpg'], '1.5x': ['https://m.media-amazon.com/images/I/81YVXgvXoAL._AC_UY327_FMwebp_QL65_.jpg', 'https://m.media-amazon.com/images/I/81u6pPXJ0xL._AC_UY218_.jpg', 'https://m.media-amazon.com/images/I/81u6pPXJ0xL._AC_UY654_FMwebp_QL65_.jpg'], '2x': ['https://m.media-amazon.com/images/I/81YVXgvXoAL._AC_UY436_FMwebp_QL65_.jpg', 'https://m.media-amazon.com/images/I/81u6pPXJ0xL._AC_UY327_FMwebp_QL65_.jpg', 'https://m.media-amazon.com/images/I/81zMsOfk63L._AC_UY218_.jpg'], '2.5x': ['https://m.media-amazon.com/images/I/81YVXgvXoAL._AC_UY545_FMwebp_QL65_.jpg', 'https://m.media-amazon.com/images/I/81u6pPXJ0xL._AC_UY436_FMwebp_QL65_.jpg', 'https://m.media-amazon.com/images/I/81zMsOfk63L._AC_UY327_FMwebp_QL65_.jpg'], '3x': [], '3.5x': [], '4x': []}","['https://images-na.ssl-images-amazon.com/images/I/81YVXgvXoAL.jpg', 'https://images-na.ssl-images-amazon.com/images/I/81zMsOfk63L.jpg']",HarperCollins
"Mort (Discworld, #4; Death, #1)",Terry Pratchett,9780061020681.0,0061020680,243,4.23,221114,1987-11-12,2020-11-27,2020-12-01,Mort,"Discworld, #4; Death",4,,0,0,0,"{'1x': ['https://m.media-amazon.com/images/I/813w9kgMaAL._AC_UY218_.jpg', 'https://m.media-amazon.com/images/I/813w9kgMaAL._AC_UY654_FMwebp_QL65_.jpg', 'https://m.media-amazon.com/images/I/91h8hVdfRPS._AC_UY545_FMwebp_QL65_.jpg'], '1.5x': ['https://m.media-amazon.com/images/I/813w9kgMaAL._AC_UY327_FMwebp_QL65_.jpg', 'https://m.media-amazon.com/images/I/91h8hVdfRPS._AC_UY218_.jpg', 'https://m.media-amazon.com/images/I/91h8hVdfRPS._AC_UY654_FMwebp_QL65_.jpg'], '2x': ['https://m.media-amazon.com/images/I/813w9kgMaAL._AC_UY436_FMwebp_QL65_.jpg', 'https://m.media-amazon.com/images/I/91h8hVdfRPS._AC_UY327_FMwebp_QL65_.jpg', 'https://m.media-amazon.com/images/I/71MCpQYSsUL._AC_UY218_.jpg'], '2.5x': ['https://m.media-amazon.com/images/I/813w9kgMaAL._AC_UY545_FMwebp_QL65_.jpg', 'https://m.media-amazon.com/images/I/91h8hVdfRPS._AC_UY436_FMwebp_QL65_.jpg', 'https://m.media-amazon.com/images/I/71MCpQYSsUL._AC_UY327_FMwebp_QL65_.jpg'], '3x': [], '3.5x': [], '4x': []}","['https://images-na.ssl-images-amazon.com/images/I/813w9kgMaAL.jpg', 'https://images-na.ssl-images-amazon.com/images/I/91h8hVdfRPS.jpg', 'https://images-na.ssl-images-amazon.com/images/I/91oZG-KAVGL.jpg', 'https://images-na.ssl-images-amazon.com/images/I/71MCpQYSsUL.jpg']",
"The Dark Talent (Alcatraz, #5)",Brandon Sanderson,9780765381408.0,0765381400,281,4.11,5766,2016-09-06,2020-11-25,2020-11-25,The Dark Talent,Alcatraz,5,https://www.goodreads.com/book/show/26114421,"I, Alcatraz Smedry, proudly announce the last book of my autobiography, and was the hardest one for me to write. Because, in it—I’m not a hero. In fact, I’m the one who screwed everything up for everyone else.
First off, my Talent for breaking things got a little out of hand, and I ended up destroying everyone else’s Talents. As in “anyone who was born with a Talent no longer has a Talent and might never get their Talent back”—and all because of a Talent of mine which I no longer have. Got it?
Even worse, my best friend Bastille (she’s a girl, and a friend, but not really my girlfriend…I think?) was put in a coma by those Librarian slugs. So I owed them one for that.
And worse than worse, I needed to enter the heart of Librarian power—the dreaded Highbrary—if I was ever going to bring Bastille back to life and stop my know-it-all hotshot renegade father from unleashing chaos all over the world just because he thinks it’s the right thing to do.","['Fantasy', 'Young Adult', 'Fiction', 'Childrens', 'Middle Grade', 'Humor']",https://i.gr-assets.com/images/S/compressed.photo.goodreads.com/books/1443207060l/26114421.jpg,"{'1x': ['https://m.media-amazon.com/images/I/91Stcs0UrnS._AC_UY218_.jpg', 'https://m.media-amazon.com/images/I/91Stcs0UrnS._AC_UY654_FMwebp_QL65_.jpg'], '1.5x': ['https://m.media-amazon.com/images/I/91Stcs0UrnS._AC_UY327_FMwebp_QL65_.jpg', 'https://m.media-amazon.com/images/I/91hBh0nfCfL._AC_UY218_.jpg'], '2x': ['https://m.media-amazon.com/images/I/91Stcs0UrnS._AC_UY436_FMwebp_QL65_.jpg', 'https://m.media-amazon.com/images/I/91hBh0nfCfL._AC_UY327_FMwebp_QL65_.jpg'], '2.5x': ['https://m.media-amazon.com/images/I/91Stcs0UrnS._AC_UY545_FMwebp_QL65_.jpg', 'https://m.media-amazon.com/images/I/91hBh0nfCfL._AC_UY436_FMwebp_QL65_.jpg'], '3x': [], '3.5x': [], '4x': []}","['https://images-na.ssl-images-amazon.com/images/I/91Stcs0UrnS.jpg', 'https://images-na.ssl-images-amazon.com/images/I/41DnnQtDv8L.jpg']",Starscape
"Alcatraz Versus the Shattered Lens (Alcatraz, #4)",Brandon Sanderson,9780439925570.0,0439925576,294,4.13,9177,2010-12-01,2020-11-25,2020-11-25,Alcatraz Versus the Shattered Lens,Alcatraz,4,https://www.goodreads.com/book/show/7740659,"Alcatraz Smedry, the boy with the incredible Talent for breaking things, has a lot to prove and little time in which to do it. In this final adventure, Alcatraz faces an army of librarians--and their giant robots--as they battle to win the kingdom of Mokia. If the librarians win the war, everything that Alcatraz has fought so hard for could end in disaster. Alcatraz must face the robots, the evil librarians, and even his own manipulative mother! But will he be able to save the kingdom of Mokia and the Free Kingdoms from the wrath of the librarians before everything comes crashing down?","['Fantasy', 'Young Adult', 'Fiction', 'Childrens', 'Middle Grade', 'Humor']",https://i.gr-assets.com/images/S/compressed.photo.goodreads.com/books/1388346197l/7740659.jpg,"{'1x': ['https://m.media-amazon.com/images/I/912AL4tE33L._AC_UY218_.jpg', 'https://m.media-amazon.com/images/I/912AL4tE33L._AC_UY654_FMwebp_QL65_.jpg', 'https://m.media-amazon.com/images/I/912ZiaMqB8L._AC_UY545_FMwebp_QL65_.jpg'], '1.5x': ['https://m.media-amazon.com/images/I/912AL4tE33L._AC_UY327_FMwebp_QL65_.jpg', 'https://m.media-amazon.com/images/I/912ZiaMqB8L._AC_UY218_.jpg', 'https://m.media-amazon.com/images/I/912ZiaMqB8L._AC_UY654_FMwebp_QL65_.jpg'], '2x': ['https://m.media-amazon.com/images/I/912AL4tE33L._AC_UY436_FMwebp_QL65_.jpg', 'https://m.media-amazon.com/images/I/912ZiaMqB8L._AC_UY327_FMwebp_QL65_.jpg', 'https://m.media-amazon.com/images/I/91zGHWxBkyL._AC_UY218_.jpg'], '2.5x': ['https://m.media-amazon.com/images/I/912AL4tE33L._AC_UY545_FMwebp_QL65_.jpg', 'https://m.media-amazon.com/images/I/912ZiaMqB8L._AC_UY436_FMwebp_QL65_.jpg', 'https://m.media-amazon.com/images/I/91zGHWxBkyL._AC_UY327_FMwebp_QL65_.jpg'], '3x': [], '3.5x': [], '4x': []}","['https://images-na.ssl-images-amazon.com/images/I/912AL4tE33L.jpg', 'https://images-na.ssl-images-amazon.com/images/I/912ZiaMqB8L.jpg', 'https://images-na.ssl-images-amazon.com/images/I/71YLoamzEmL.jpg']",Scholastic Press
"Alcatraz Versus the Knights of Crystallia (Alcatraz, #3)",Brandon Sanderson,9780439925556.0,043992555X,299,4.12,10663,2009-10-01,2020-11-23,2020-11-24,Alcatraz Versus the Knights of Crystallia,Alcatraz,3,https://www.goodreads.com/book/show/6366110,"When Alcatraz and Grandpa Smedry make a pilgrimage to the Free Kingdom city of Crystallia, the Smedry home base, Alcatraz is shocked to see that he is, in fact, a legend. When he was a baby he was stolen by the Evil Librarians, and his mother, a Librarian herself, was behind the whole scheme. Now, with his estranged father, who is acting indeed strange, Bastille, who has been stripped of her armor, and Grandpa Smedry, who is, as always, late to everything (that's his Talent), Alcatraz tries to save a city under siege. From who? Why, the Librarians of course!","['Fantasy', 'Young Adult', 'Fiction', 'Childrens', 'Middle Grade', 'Humor']",https://i.gr-assets.com/images/S/compressed.photo.goodreads.com/books/1304976247l/6366110.jpg,"{'1x': ['https://m.media-amazon.com/images/I/81VcYVOioBL._AC_UY218_.jpg'], '1.5x': ['https://m.media-amazon.com/images/I/81VcYVOioBL._AC_UY327_FMwebp_QL65_.jpg'], '2x': ['https://m.media-amazon.com/images/I/81VcYVOioBL._AC_UY436_FMwebp_QL65_.jpg'], '2.5x': ['https://m.media-amazon.com/images/I/81VcYVOioBL._AC_UY545_FMwebp_QL65_.jpg'], '3x': [], '3.5x': [], '4x': []}",['https://images-na.ssl-images-amazon.com/images/I/81VcYVOioBL.jpg'],Scholastic Press
