"The Last Wish (The Witcher, #0.5)",Andrzej Sapkowski,,,359,4.13,279014,1993-01-31,,,The Last Wish,The Witcher,0,https://www.goodreads.com/book/show/40603587,"Geralt the Witcher—revered and hated—is a man whose magic powers, enhanced by long training and a mysterious elixir, have made him a brilliant fighter and a merciless assassin. Yet he is no ordinary murderer: his targets are the multifarious monsters and vile fiends that ravage the land and attack the innocent.
But not everything monstrous-looking is evil and not everythin

...more","['Fantasy', 'Fiction', 'Short Stories', 'Audiobook', 'Fantasy', 'High Fantasy']",https://i.gr-assets.com/images/S/compressed.photo.goodreads.com/books/1529591917l/40603587._SX318_.jpg,"{'1x': ['https://m.media-amazon.com/images/I/51syszk4ZjL._AC_UY218_.jpg', 'https://m.media-amazon.com/images/I/51syszk4ZjL._AC_UY500_FMwebp_QL65_.jpg', 'https://m.media-amazon.com/images/I/61Op6k-4MeL._AC_UY545_FMwebp_QL65_.jpg'], '1.5x': ['https://m.media-amazon.com/images/I/51syszk4ZjL._AC_UY327_FMwebp_QL65_.jpg', 'https://m.media-amazon.com/images/I/61Op6k-4MeL._AC_UY218_.jpg', 'https://m.media-amazon.com/images/I/61Op6k-4MeL._AC_UY654_FMwebp_QL65_.jpg'], '2x': ['https://m.media-amazon.com/images/I/51syszk4ZjL._AC_UY436_FMwebp_QL65_.jpg', 'https://m.media-amazon.com/images/I/61Op6k-4MeL._AC_UY327_FMwebp_QL65_.jpg', 'https://m.media-amazon.com/images/I/91aoh8uMxqL._AC_UY218_.jpg'], '2.5x': ['https://m.media-amazon.com/images/I/61Op6k-4MeL._AC_UY436_FMwebp_QL65_.jpg', 'https://m.media-amazon.com/images/I/91aoh8uMxqL._AC_UY327_FMwebp_QL65_.jpg'], '3x': [], '3.5x': [], '4x': []}","['https://images-na.ssl-images-amazon.com/images/I/51syszk4ZjL.jpg', 'https://images-na.ssl-images-amazon.com/images/I/61Op6k-4MeL.jpg', 'https://images-na.ssl-images-amazon.com/images/I/71XfTTQaK+L.jpg', 'https://images-na.ssl-images-amazon.com/images/I/81AUcKT2aUL.jpg']",Orbit
"The Time of Contempt (The Witcher, #2)",Andrzej Sapkowski,9780316219136.0,0316219134,331,4.17,106947,1995-01-01,,,The Time of Contempt,The Witcher,2,https://www.goodreads.com/book/show/14781491,"The New York Times bestselling series that inspired the international hit video game: The Witcher
Geralt is a witcher: guardian of the innocent; protector of those in need; a defender, in dark times, against some of the most frightening creatures of myth and legend. His task, now, is to protect Ciri. A child of prophecy, she will have the power to change the world for good or for ill -- but only if she lives to use it.
A coup threatens the Wizard's Guild.
War breaks out across the lands.
A serious injury leaves Geralt fighting for his life...
... and Ciri, in whose hands the world's fate rests, has vanished...
The Witcher returns in this sequel to Blood of Elves.

The Witcher series
The Last Wish
The Sword of Destiny
Blood of Elves
The Time of Contempt
Baptism of Fire
The Malady and Other Stories: An Andrzej Sapkowski Sampler (e-only)","['Fantasy', 'Fiction', 'Audiobook', 'European Literature', 'Polish Literature', 'Fantasy']",https://i.gr-assets.com/images/S/compressed.photo.goodreads.com/books/1443278961l/14781491._SY475_.jpg,"{'1x': ['https://m.media-amazon.com/images/I/81TqD+qHjeL._AC_UY218_.jpg'], '1.5x': ['https://m.media-amazon.com/images/I/81TqD+qHjeL._AC_UY327_FMwebp_QL65_.jpg'], '2x': ['https://m.media-amazon.com/images/I/81TqD+qHjeL._AC_UY436_FMwebp_QL65_.jpg'], '2.5x': ['https://m.media-amazon.com/images/I/81TqD+qHjeL._AC_UY545_FMwebp_QL65_.jpg'], '3x': [], '3.5x': [], '4x': []}","['https://images-na.ssl-images-amazon.com/images/I/81TqD+qHjeL.jpg', 'https://images-na.ssl-images-amazon.com/images/I/81ePxX1mfQL.jpg', 'https://images-na.ssl-images-amazon.com/images/I/41DFQr-RUeS.jpg', 'https://images-na.ssl-images-amazon.com/images/I/61hsuKwU41S.jpg']",Orbit
"Crystal Crowned (Air Awakens, #5)",Elise Kova,,,400,4.16,15798,2016-07-12,,,Crystal Crowned,Air Awakens,5,https://www.goodreads.com/book/show/29966062,"Long live Solaris. One bloodthirsty ruler has been overthrown by another, casting the shadow of death over the Solaris Empire. Vhalla Yarl stands upon the stage of fate, prepared to do battle one final time. Fragile alliances will be tested and new bonds will be formed as the world is reshaped. She fights as the champion of peace, but when the night is darkest will she be able to pay the price of a new dawn?","['Fantasy', 'Young Adult', 'Romance', 'Fantasy', 'Magic', 'Fantasy']",https://i.gr-assets.com/images/S/compressed.photo.goodreads.com/books/1461167707l/29966062._SY475_.jpg,"{'1x': ['https://m.media-amazon.com/images/I/713FovIxusL._AC_UY218_.jpg', 'https://m.media-amazon.com/images/I/713FovIxusL._AC_UY654_FMwebp_QL65_.jpg', 'https://m.media-amazon.com/images/I/71sE1D2f3pL._AC_UY545_FMwebp_QL65_.jpg'], '1.5x': ['https://m.media-amazon.com/images/I/713FovIxusL._AC_UY327_FMwebp_QL65_.jpg', 'https://m.media-amazon.com/images/I/71sE1D2f3pL._AC_UY218_.jpg', 'https://m.media-amazon.com/images/I/71sE1D2f3pL._AC_UY654_FMwebp_QL65_.jpg'], '2x': ['https://m.media-amazon.com/images/I/713FovIxusL._AC_UY436_FMwebp_QL65_.jpg', 'https://m.media-amazon.com/images/I/71sE1D2f3pL._AC_UY327_FMwebp_QL65_.jpg', 'https://m.media-amazon.com/images/I/91kxjbzobJL._AC_UY218_.jpg'], '2.5x': ['https://m.media-amazon.com/images/I/713FovIxusL._AC_UY545_FMwebp_QL65_.jpg', 'https://m.media-amazon.com/images/I/71sE1D2f3pL._AC_UY436_FMwebp_QL65_.jpg', 'https://m.media-amazon.com/images/I/91kxjbzobJL._AC_UY327_FMwebp_QL65_.jpg'], '3x': [], '3.5x': [], '4x': []}","['https://images-na.ssl-images-amazon.com/images/I/713FovIxusL.jpg', 'https://images-na.ssl-images-amazon.com/images/I/71W2KNdRXBS.jpg', 'https://images-na.ssl-images-amazon.com/images/I/71sE1D2f3pL.jpg', 'https://images-na.ssl-images-amazon.com/images/I/71t5Sg1JNxL.jpg']",Silver Wing Press
"Water's Wrath (Air Awakens, #4)",Elise Kova,9781619844254.0,1619844257,378,4.12,18833,2016-04-26,,,Water's Wrath,Air Awakens,4,https://www.goodreads.com/book/show/29483403,"Librarian turned sorcerer. Sorcerer turned hero. Hero turned puppet.
The Solaris Empire found victory in the North and, at the cost of her heart and her innocence, Vhalla Yarl has earned her freedom. But the true fight is only beginning as the secret forces that have been lurking in the shadows, tugging at the strings of Vhalla's fate, finally come to light. Nowhere is safe, and Vhalla must tread carefully or else she'll fall into the waiting arms of her greatest foe. Or former lover.","['Fantasy', 'Young Adult', 'Romance', 'Fantasy', 'Magic', 'Fantasy']",https://i.gr-assets.com/images/S/compressed.photo.goodreads.com/books/1459114125l/29483403.jpg,,,
"Fire Falling (Air Awakens, #2)",Elise Kova,9781619849525.0,1619849526,378,4.18,26357,2015-11-19,2021-04-23,2021-04-24,Fire Falling,Air Awakens,2,https://www.goodreads.com/book/show/26047438,"Soldier… Sorcerer… Savior… Who is Vhalla Yarl?
Vhalla Yarl marches to war as property of the Solaris Empire. The Emperor counts on her to bring victory, the Senate counts on her death, and the only thing Vhalla can count on is the fight of her life.
As she grapples with the ghosts of her past, new challenges in the present threaten to shatter the remnants of her fragile sanity. Will she maintain her humanity? Or will she truly become the Empire’s monster?
Fire Falling is the second book in the Air Awakens Series.","['Fantasy', 'Romance', 'Young Adult', 'Fantasy', 'Magic', 'Fantasy']",https://i.gr-assets.com/images/S/compressed.photo.goodreads.com/books/1440388938l/26047438.jpg,"{'1x': ['https://m.media-amazon.com/images/I/7158iigGiKL._AC_UY218_.jpg', 'https://m.media-amazon.com/images/I/7158iigGiKL._AC_UY654_FMwebp_QL65_.jpg'], '1.5x': ['https://m.media-amazon.com/images/I/7158iigGiKL._AC_UY327_FMwebp_QL65_.jpg', 'https://m.media-amazon.com/images/I/71MqoG8YFoL._AC_UY218_.jpg'], '2x': ['https://m.media-amazon.com/images/I/7158iigGiKL._AC_UY436_FMwebp_QL65_.jpg', 'https://m.media-amazon.com/images/I/71MqoG8YFoL._AC_UY327_FMwebp_QL65_.jpg'], '2.5x': ['https://m.media-amazon.com/images/I/7158iigGiKL._AC_UY545_FMwebp_QL65_.jpg', 'https://m.media-amazon.com/images/I/71MqoG8YFoL._AC_UY436_FMwebp_QL65_.jpg'], '3x': [], '3.5x': [], '4x': []}","['https://images-na.ssl-images-amazon.com/images/I/7158iigGiKL.jpg', 'https://images-na.ssl-images-amazon.com/images/I/61LK26a8ALL.jpg', 'https://images-na.ssl-images-amazon.com/images/I/31qTiBGY3ZL.jpg', 'https://images-na.ssl-images-amazon.com/images/I/71MqoG8YFoL.jpg', 'https://images-na.ssl-images-amazon.com/images/I/61zueF4NL5L.jpg', 'https://images-na.ssl-images-amazon.com/images/I/31nF53McmJL.jpg']",Silver Wing Press
"Air Awakens (Air Awakens, #1)",Elise Kova,9781932549935.0,1932549935,342,4.01,40404,2015-08-27,2021-04-21,2021-04-23,Air Awakens,Air Awakens,1,https://www.goodreads.com/book/show/23127048,"A library apprentice, a sorcerer prince, and an unbreakable magic bond...
The Solaris Empire is one conquest away from uniting the continent, and the rare elemental magic sleeping in seventeen-year-old library apprentice Vhalla Yarl could shift the tides of war.
Vhalla has always been taught to fear the Tower of Sorcerers, a mysterious magic society, and has been happy in her quiet world of books. But after she unknowingly saves the life of one of the most powerful sorcerers of them all—the Crown Prince Aldrik—she finds herself enticed into his world.
Now she must decide her future: Embrace her sorcery and leave the life she’s known, or eradicate her magic and remain as she’s always been. And with powerful forces lurking in the shadows, Vhalla’s indecision could cost her more than she ever imagined.","['Fantasy', 'Young Adult', 'Romance', 'Fantasy', 'Magic', 'Young Adult']",https://i.gr-assets.com/images/S/compressed.photo.goodreads.com/books/1432967839l/23127048._SY475_.jpg,"{'1x': ['https://m.media-amazon.com/images/I/71vKdXlNz4L._AC_UY218_.jpg', 'https://m.media-amazon.com/images/I/71vKdXlNz4L._AC_UY654_FMwebp_QL65_.jpg', 'https://m.media-amazon.com/images/I/81E3rMMVkiL._AC_UY545_FMwebp_QL65_.jpg'], '1.5x': ['https://m.media-amazon.com/images/I/71vKdXlNz4L._AC_UY327_FMwebp_QL65_.jpg', 'https://m.media-amazon.com/images/I/81E3rMMVkiL._AC_UY218_.jpg', 'https://m.media-amazon.com/images/I/81E3rMMVkiL._AC_UY654_FMwebp_QL65_.jpg'], '2x': ['https://m.media-amazon.com/images/I/71vKdXlNz4L._AC_UY436_FMwebp_QL65_.jpg', 'https://m.media-amazon.com/images/I/81E3rMMVkiL._AC_UY327_FMwebp_QL65_.jpg', 'https://m.media-amazon.com/images/I/91kxjbzobJL._AC_UY218_.jpg'], '2.5x': ['https://m.media-amazon.com/images/I/71vKdXlNz4L._AC_UY545_FMwebp_QL65_.jpg', 'https://m.media-amazon.com/images/I/81E3rMMVkiL._AC_UY436_FMwebp_QL65_.jpg', 'https://m.media-amazon.com/images/I/91kxjbzobJL._AC_UY327_FMwebp_QL65_.jpg'], '3x': [], '3.5x': [], '4x': []}","['https://images-na.ssl-images-amazon.com/images/I/71vKdXlNz4L.jpg', 'https://images-na.ssl-images-amazon.com/images/I/71M2pkOZZ5L.jpg']",Silver Wing Press
"Imagine Me (Shatter Me, #6)",Tahereh Mafi,9780062676443.0,006267644X,480,3.92,57994,2020-04-02,,,Imagine Me,Shatter Me,6,https://www.goodreads.com/book/show/44054122,"The explosive finale to the New York Times and USA Today bestselling Shatter Me series.
Juliette Ferrars.
Ella Sommers.
Which is the truth and which is the lie?
Now that Ella knows who Juliette is and what she was created for, things have only become more complicated. As she struggles to understand the past that haunts her and looks to a future more uncertain than ever, the lines between right and wrong—between Ella and Juliette—blur. And with old enemies looming, her destiny may not be her own to control.
The day of reckoning for the Reestablishment is coming. But she may not get to choose what side she fights on.","['Fantasy', 'Science Fiction', 'Dystopia', 'Young Adult', 'Romance', 'Science Fiction']",https://i.gr-assets.com/images/S/compressed.photo.goodreads.com/books/1563815428l/44054122.jpg,"{'1x': ['https://m.media-amazon.com/images/I/714Pnja0JyL._AC_UY218_.jpg', 'https://m.media-amazon.com/images/I/714Pnja0JyL._AC_UY654_FMwebp_QL65_.jpg'], '1.5x': ['https://m.media-amazon.com/images/I/714Pnja0JyL._AC_UY327_FMwebp_QL65_.jpg', 'https://m.media-amazon.com/images/I/51cfhDWOEAL._AC_UY218_.jpg'], '2x': ['https://m.media-amazon.com/images/I/714Pnja0JyL._AC_UY436_FMwebp_QL65_.jpg', 'https://m.media-amazon.com/images/I/51cfhDWOEAL._AC_UY327_FMwebp_QL65_.jpg'], '2.5x': ['https://m.media-amazon.com/images/I/714Pnja0JyL._AC_UY545_FMwebp_QL65_.jpg'], '3x': [], '3.5x': [], '4x': []}","['https://images-na.ssl-images-amazon.com/images/I/714Pnja0JyL.jpg', 'https://images-na.ssl-images-amazon.com/images/I/51cfhDWOEAL.jpg', 'https://images-na.ssl-images-amazon.com/images/I/51jRTKU5ubL.jpg', 'https://images-na.ssl-images-amazon.com/images/I/91u-K1lc+qL.jpg', 'https://images-na.ssl-images-amazon.com/images/I/81hMDayW1GL.jpg', 'https://images-na.ssl-images-amazon.com/images/I/81Hx1MRoXyL.jpg', 'https://images-na.ssl-images-amazon.com/images/I/51pKKksdkeL.jpg', 'https://images-na.ssl-images-amazon.com/images/I/71eXXE8uTkL.jpg', 'https://images-na.ssl-images-amazon.com/images/I/81C11KfiqrL.jpg', 'https://images-na.ssl-images-amazon.com/images/I/810ZAZWEhrL.jpg']",HarperCollins
"Defy Me (Shatter Me, #5)",Tahereh Mafi,9780062676399.0,0062676393,357,4.23,74824,2019-04-02,,,Defy Me,Shatter Me,5,https://www.goodreads.com/book/show/34992959,"The gripping fifth installment in the New York Times, USA Today, and Publishers Weekly bestselling Shatter Me series. Will Juliette’s broken heart make her vulnerable to the strengthening darkness within her?
Juliette’s short tenure as the supreme commander of North America has been an utter disaster. When the children of the other world leaders show up on her doorstep, she wants nothing more than to turn to Warner for support and guidance. But he shatters her heart when he reveals that he’s been keeping secrets about her family and her identity from her—secrets that change everything.
Juliette is devastated, and the darkness that’s always dwelled within her threatens to consume her. An explosive encounter with unexpected visitors might be enough to push her over the edge.","['Science Fiction', 'Dystopia', 'Fantasy', 'Young Adult', 'Romance', 'Science Fiction']",https://i.gr-assets.com/images/S/compressed.photo.goodreads.com/books/1548349704l/34992959.jpg,"{'1x': ['https://m.media-amazon.com/images/I/81If+18+wGL._AC_UY218_.jpg', 'https://m.media-amazon.com/images/I/81If+18+wGL._AC_UY654_FMwebp_QL65_.jpg', 'https://m.media-amazon.com/images/I/71fO9VtGGiL._AC_UY545_FMwebp_QL65_.jpg'], '1.5x': ['https://m.media-amazon.com/images/I/81If+18+wGL._AC_UY327_FMwebp_QL65_.jpg', 'https://m.media-amazon.com/images/I/71fO9VtGGiL._AC_UY218_.jpg', 'https://m.media-amazon.com/images/I/71fO9VtGGiL._AC_UY654_FMwebp_QL65_.jpg'], '2x': ['https://m.media-amazon.com/images/I/81If+18+wGL._AC_UY436_FMwebp_QL65_.jpg', 'https://m.media-amazon.com/images/I/71fO9VtGGiL._AC_UY327_FMwebp_QL65_.jpg', 'https://m.media-amazon.com/images/I/511cMnTdQkL._AC_UY218_.jpg'], '2.5x': ['https://m.media-amazon.com/images/I/81If+18+wGL._AC_UY545_FMwebp_QL65_.jpg', 'https://m.media-amazon.com/images/I/71fO9VtGGiL._AC_UY436_FMwebp_QL65_.jpg'], '3x': [], '3.5x': [], '4x': []}","['https://images-na.ssl-images-amazon.com/images/I/81If+18+wGL.jpg', 'https://images-na.ssl-images-amazon.com/images/I/71fO9VtGGiL.jpg', 'https://images-na.ssl-images-amazon.com/images/I/71fO9VtGGiL.jpg', 'https://images-na.ssl-images-amazon.com/images/I/71hk0JS4cbL.jpg', 'https://images-na.ssl-images-amazon.com/images/I/81nL0SMcrnL.jpg', 'https://images-na.ssl-images-amazon.com/images/I/71vkGOsw3QL.jpg', 'https://images-na.ssl-images-amazon.com/images/I/8185bsBb5xL.jpg', 'https://images-na.ssl-images-amazon.com/images/I/81Jss0jgTKL.jpg', 'https://images-na.ssl-images-amazon.com/images/I/81W3AhsxE0L.jpg', 'https://images-na.ssl-images-amazon.com/images/I/511cMnTdQkL.jpg']",HarperTeen
"Restore Me (Shatter Me, #4)",Tahereh Mafi,9780062676368.0,0062676369,435,4.16,95269,2018-03-06,,,Restore Me,Shatter Me,4,https://www.goodreads.com/book/show/34992929,"Juliette Ferrars thought she'd won. She took over Sector 45, was named the new Supreme Commander, and now has Warner by her side. But she's still the girl with the ability to kill with a single touch—and now she's got the whole world in the palm of her hand. When tragedy hits, who will she become? Will she be able to control the power she wields and use it for good?","['Science Fiction', 'Dystopia', 'Fantasy', 'Young Adult', 'Romance', 'Science Fiction']",https://i.gr-assets.com/images/S/compressed.photo.goodreads.com/books/1507232049l/34992929.jpg,"{'1x': ['https://m.media-amazon.com/images/I/81sK0G5cHsL._AC_UY218_.jpg'], '1.5x': ['https://m.media-amazon.com/images/I/81sK0G5cHsL._AC_UY327_FMwebp_QL65_.jpg'], '2x': ['https://m.media-amazon.com/images/I/81sK0G5cHsL._AC_UY436_FMwebp_QL65_.jpg'], '2.5x': ['https://m.media-amazon.com/images/I/81sK0G5cHsL._AC_UY545_FMwebp_QL65_.jpg'], '3x': [], '3.5x': [], '4x': []}","['https://images-na.ssl-images-amazon.com/images/I/81sK0G5cHsL.jpg', 'https://images-na.ssl-images-amazon.com/images/I/519g-X0bO4S.jpg', 'https://images-na.ssl-images-amazon.com/images/I/51eC4ZS7EdS.jpg']",HarperCollins
"Ignite Me (Shatter Me, #3)",Tahereh Mafi,,,421,4.43,232000,2014-02-04,,,Ignite Me,Shatter Me,3,https://www.goodreads.com/book/show/13188676,"With Omega Point destroyed, Juliette doesn’t know if the rebels, her friends, or even Adam are alive. But that won’t keep her from trying to take down The Reestablishment once and for all. Now she must rely on Warner, the handsome commander of Sector 45. The one person she never thought she could trust. The same person who saved her life. He promises to help Juliette master her powers and save their dying world . . . but that’s not all he wants with her.","['Science Fiction', 'Dystopia', 'Young Adult', 'Fantasy', 'Romance', 'Science Fiction']",https://i.gr-assets.com/images/S/compressed.photo.goodreads.com/books/1375972497l/13188676.jpg,"{'1x': ['https://m.media-amazon.com/images/I/81nOnX5BqfL._AC_UY218_.jpg'], '1.5x': ['https://m.media-amazon.com/images/I/81nOnX5BqfL._AC_UY327_FMwebp_QL65_.jpg'], '2x': ['https://m.media-amazon.com/images/I/81nOnX5BqfL._AC_UY436_FMwebp_QL65_.jpg'], '2.5x': ['https://m.media-amazon.com/images/I/81nOnX5BqfL._AC_UY545_FMwebp_QL65_.jpg'], '3x': [], '3.5x': [], '4x': []}","['https://images-na.ssl-images-amazon.com/images/I/81nOnX5BqfL.jpg', 'https://images-na.ssl-images-amazon.com/images/I/71tpZiRYRQL.jpg', 'https://images-na.ssl-images-amazon.com/images/I/516+PR1zVNL.jpg', 'https://images-na.ssl-images-amazon.com/images/I/51LFxST+nQL.jpg', 'https://images-na.ssl-images-amazon.com/images/I/51yJZPePwGL.jpg', 'https://images-na.ssl-images-amazon.com/images/I/51tGSU7rurL.jpg']",HarperCollins
"Unravel Me (Shatter Me, #2)",Tahereh Mafi,9780062085535.0,0062085530,461,4.19,276033,2013-02-05,,,Unravel Me,Shatter Me,2,https://www.goodreads.com/book/show/13104080,"The thrilling second installment in New York Times bestselling author Tahereh Mafi’s Shatter Me series.
It should have taken Juliette a single touch to kill Warner. But his mysterious immunity to her deadly power has left her shaken, wondering why her ultimate defense mechanism failed against the person she most needs protection from.
She and Adam were able to escape Warner’s clutches and join up with a group of rebels, many of whom have powers of their own. Juliette will finally be able to actively fight against The Reestablishment and try to fix her broken world. And perhaps these new allies can help her shed light on the secret behind Adam’s—and Warner’s—immunity to her killer skin.
Juliette’s world is packed with high-stakes action and tantalizing romance, perfect for fans of the Red Queen series by Victoria Aveyard and the Darkest Minds trilogy by Alexandra Bracken.
Ransom Riggs, #1 New York Times bestselling author of Miss Peregrine's Home for Peculiar Children, raved: ""A thrilling, high-stakes saga of self-discovery and forbidden love, the Shatter Me series is a must-read for fans of dystopian young-adult literature—or any literature!""","['Science Fiction', 'Dystopia', 'Young Adult', 'Fantasy', 'Romance', 'Science Fiction']",https://i.gr-assets.com/images/S/compressed.photo.goodreads.com/books/1340287622l/13104080.jpg,"{'1x': ['https://m.media-amazon.com/images/I/91eM8mDn02L._AC_UY218_.jpg', 'https://m.media-amazon.com/images/I/91eM8mDn02L._AC_UY654_FMwebp_QL65_.jpg', 'https://m.media-amazon.com/images/I/511cMnTdQkL._AC_UY436_FMwebp_QL65_.jpg'], '1.5x': ['https://m.media-amazon.com/images/I/91eM8mDn02L._AC_UY327_FMwebp_QL65_.jpg', 'https://m.media-amazon.com/images/I/511cMnTdQkL._AC_UY218_.jpg', 'https://m.media-amazon.com/images/I/511cMnTdQkL._AC_UY500_FMwebp_QL65_.jpg'], '2x': ['https://m.media-amazon.com/images/I/91eM8mDn02L._AC_UY436_FMwebp_QL65_.jpg', 'https://m.media-amazon.com/images/I/511cMnTdQkL._AC_UY327_FMwebp_QL65_.jpg', 'https://m.media-amazon.com/images/I/61Z3VuQmH9L._AC_UY218_.jpg'], '2.5x': ['https://m.media-amazon.com/images/I/91eM8mDn02L._AC_UY545_FMwebp_QL65_.jpg', 'https://m.media-amazon.com/images/I/61Z3VuQmH9L._AC_UY327_FMwebp_QL65_.jpg'], '3x': [], '3.5x': [], '4x': []}","['https://images-na.ssl-images-amazon.com/images/I/511cMnTdQkL.jpg', 'https://images-na.ssl-images-amazon.com/images/I/61Z3VuQmH9L.jpg']",HarperCollins
"Destroy Me (Shatter Me, #1.5)",Tahereh Mafi,9780062208194.0,0062208195,111,4.14,119144,2012-10-02,,,Destroy Me,Shatter Me,1,https://www.goodreads.com/book/show/13623150,"Juliette escaped from The Reestablishment by seducing Warner—and then putting a bullet in his shoulder. But as she’ll learn in Destroy Me, Warner is not that easy to get rid of...
Back at the base and recovering from his near-fatal wound, Warner must do everything in his power to keep his soldiers in check and suppress any mention of a rebellion in the sector. Still as obsessed with Juliette as ever, his first priority is to find her, bring her back, and dispose of Adam and Kenji, the two traitors who helped her escape. But when Warner’s father, The Supreme Commander of The Reestablishment, arrives to correct his son’s mistakes, it’s clear that he has much different plans for Juliette. Plans Warner simply cannot allow.
Set after Shatter Me and before its forthcoming sequel, Unravel Me, Destroy Me is a novella told from the perspective of Warner, the ruthless leader of Sector 45.","['Science Fiction', 'Dystopia', 'Young Adult', 'Fantasy', 'Romance', 'Novella']",https://i.gr-assets.com/images/S/compressed.photo.goodreads.com/books/1340398466l/13623150.jpg,"{'1x': ['https://m.media-amazon.com/images/I/81KDJDxfrsL._AC_UY218_.jpg', 'https://m.media-amazon.com/images/I/81KDJDxfrsL._AC_UY654_FMwebp_QL65_.jpg'], '1.5x': ['https://m.media-amazon.com/images/I/81KDJDxfrsL._AC_UY327_FMwebp_QL65_.jpg', 'https://m.media-amazon.com/images/I/91TyHLFtNzL._AC_UY218_.jpg'], '2x': ['https://m.media-amazon.com/images/I/81KDJDxfrsL._AC_UY436_FMwebp_QL65_.jpg', 'https://m.media-amazon.com/images/I/91TyHLFtNzL._AC_UY327_FMwebp_QL65_.jpg'], '2.5x': ['https://m.media-amazon.com/images/I/81KDJDxfrsL._AC_UY545_FMwebp_QL65_.jpg', 'https://m.media-amazon.com/images/I/91TyHLFtNzL._AC_UY436_FMwebp_QL65_.jpg'], '3x': [], '3.5x': [], '4x': []}",[],Harper
