"The Burning Maze (The Trials of Apollo, #3)",Rick Riordan,9781368024129.0,1484746430,448,4.32,63184,2018-05-01,2020-04-28,2020-05-01,The Burning Maze,The Trials of Apollo,3,https://www.goodreads.com/book/show/28006096,"The formerly glorious god Apollo, cast down to earth in punishment by Zeus, is now an awkward mortal teenager named Lester Papadopoulos. In order to regain his place on Mount Olympus, Lester must restore five Oracles that have gone dark. But he has to achieve this impossible task without having any godly powers and while being duty-bound to a confounding young daughter of Demeter named Meg. Thanks a lot, Dad.
With the help of some demigod friends, Lester managed to survive his first two trials, one at Camp Half-Blood, and one in Indianapolis, where Meg received the Dark Prophecy. The words she uttered while seated on the Throne of Memory revealed that an evil triumvirate of Roman emperors plans to attack Camp Jupiter. While Leo flies ahead on Festus to warn the Roman camp, Lester and Meg must go through the Labyrinth to find the third emperor—and an Oracle who speaks in word puzzles—somewhere in the American Southwest. There is one glimmer of hope in the gloom-filled prophecy: The cloven guide alone the way does know. They will have a satyr companion, and Meg knows just who to call upon. . . .","['Fantasy', 'Fantasy', 'Mythology', 'Young Adult', 'Childrens', 'Middle Grade']",https://i.gr-assets.com/images/S/compressed.photo.goodreads.com/books/1516363168l/28006096.jpg,"{'1x': ['https://m.media-amazon.com/images/I/91X1ut15P4L._AC_UY218_.jpg', 'https://m.media-amazon.com/images/I/91X1ut15P4L._AC_UY654_FMwebp_QL65_.jpg', 'https://m.media-amazon.com/images/I/51PM0feDHNL._AC_UY436_FMwebp_QL65_.jpg'], '1.5x': ['https://m.media-amazon.com/images/I/91X1ut15P4L._AC_UY327_FMwebp_QL65_.jpg', 'https://m.media-amazon.com/images/I/51PM0feDHNL._AC_UY218_.jpg', 'https://m.media-amazon.com/images/I/51PM0feDHNL._AC_UY500_FMwebp_QL65_.jpg'], '2x': ['https://m.media-amazon.com/images/I/91X1ut15P4L._AC_UY436_FMwebp_QL65_.jpg', 'https://m.media-amazon.com/images/I/51PM0feDHNL._AC_UY327_FMwebp_QL65_.jpg', 'https://m.media-amazon.com/images/I/71Wk3FXt6CL._AC_UY218_.jpg'], '2.5x': ['https://m.media-amazon.com/images/I/91X1ut15P4L._AC_UY545_FMwebp_QL65_.jpg', 'https://m.media-amazon.com/images/I/71Wk3FXt6CL._AC_UY327_FMwebp_QL65_.jpg'], '3x': [], '3.5x': [], '4x': []}","['https://images-na.ssl-images-amazon.com/images/I/91X1ut15P4L.jpg', 'https://images-na.ssl-images-amazon.com/images/I/51PM0feDHNL.jpg', 'https://images-na.ssl-images-amazon.com/images/I/91G1bVdLmLL.jpg', 'https://images-na.ssl-images-amazon.com/images/I/81h2L0xr6XL.jpg', 'https://images-na.ssl-images-amazon.com/images/I/910NfqAPmRL.jpg', 'https://images-na.ssl-images-amazon.com/images/I/81fgtCbieiL.jpg', 'https://images-na.ssl-images-amazon.com/images/I/91o4UBRuNTL.jpg', 'https://images-na.ssl-images-amazon.com/images/I/81nxJQkCv3S.jpg', 'https://images-na.ssl-images-amazon.com/images/I/71ft7xF4UwS.jpg', 'https://images-na.ssl-images-amazon.com/images/I/71Wk3FXt6CL.jpg']",Disney-Hyperion
"The Hidden Oracle (The Trials of Apollo, #1)",Rick Riordan,9781484732748.0,148473274X,384,4.19,149688,2016-05-03,2020-04-22,2020-04-24,The Hidden Oracle,The Trials of Apollo,1,https://www.goodreads.com/book/show/26252859,"How do you punish an immortal?
By making him human.
After angering his father Zeus, the god Apollo is cast down from Olympus. Weak and disorientated, he lands in New York City as a regular teenage boy. Now, without his godly powers, the four-thousand-year-old deity must learn to survive in the modern world until he can somehow find a way to regain Zeus's favour.
But Apollo has many enemies—gods, monsters and mortals who would love to see the former Olympian permanently destroyed. Apollo needs help, and he can think of only one place to go... an enclave of modern demigods known as Camp Half-Blood.","['Fantasy', 'Fantasy', 'Mythology', 'Young Adult', 'Childrens', 'Middle Grade']",https://i.gr-assets.com/images/S/compressed.photo.goodreads.com/books/1449765273l/26252859.jpg,"{'1x': ['https://m.media-amazon.com/images/I/91bkraZV85L._AC_UY218_.jpg', 'https://m.media-amazon.com/images/I/91bkraZV85L._AC_UY654_FMwebp_QL65_.jpg'], '1.5x': ['https://m.media-amazon.com/images/I/91bkraZV85L._AC_UY327_FMwebp_QL65_.jpg', 'https://m.media-amazon.com/images/I/51PM0feDHNL._AC_UY218_.jpg'], '2x': ['https://m.media-amazon.com/images/I/91bkraZV85L._AC_UY436_FMwebp_QL65_.jpg', 'https://m.media-amazon.com/images/I/51PM0feDHNL._AC_UY327_FMwebp_QL65_.jpg'], '2.5x': ['https://m.media-amazon.com/images/I/91bkraZV85L._AC_UY545_FMwebp_QL65_.jpg'], '3x': [], '3.5x': [], '4x': []}","['https://images-na.ssl-images-amazon.com/images/I/91bkraZV85L.jpg', 'https://images-na.ssl-images-amazon.com/images/I/51PM0feDHNL.jpg', 'https://images-na.ssl-images-amazon.com/images/I/91G1bVdLmLL.jpg', 'https://images-na.ssl-images-amazon.com/images/I/81h2L0xr6XL.jpg', 'https://images-na.ssl-images-amazon.com/images/I/910NfqAPmRL.jpg', 'https://images-na.ssl-images-amazon.com/images/I/81fgtCbieiL.jpg', 'https://images-na.ssl-images-amazon.com/images/I/91o4UBRuNTL.jpg', 'https://images-na.ssl-images-amazon.com/images/I/81nxJQkCv3S.jpg', 'https://images-na.ssl-images-amazon.com/images/I/71ft7xF4UwS.jpg']",Disney-Hyperion
"Elantris (Elantris, #1)",Brandon Sanderson,9780765350374.0,0765350378,622,4.18,215210,2005-05-01,2020-04-24,2020-05-23,Elantris,Elantris,1,https://www.goodreads.com/book/show/68427,"Elantris was the capital of Arelon: gigantic, beautiful, literally radiant, filled with benevolent beings who used their powerful magical abilities for the benefit of all. Yet each of these demigods was once an ordinary person until touched by the mysterious transforming power of the Shaod. Ten years ago, without warning, the magic failed. Elantrians became wizened, leper-like, powerless creatures, and Elantris itself dark, filthy, and crumbling.
Arelon's new capital, Kae, crouches in the shadow of Elantris. Princess Sarene of Teod arrives for a marriage of state with Crown Prince Raoden, hoping—based on their correspondence—to also find love. She finds instead that Raoden has died and she is considered his widow. Both Teod and Arelon are under threat as the last remaining holdouts against the imperial ambitions of the ruthless religious fanatics of Fjordell. So Sarene decides to use her new status to counter the machinations of Hrathen, a Fjordell high priest who has come to Kae to convert Arelon and claim it for his emperor and his god.
But neither Sarene nor Hrathen suspect the truth about Prince Raoden. Stricken by the same curse that ruined Elantris, Raoden was secretly exiled by his father to the dark city. His struggle to help the wretches trapped there begins a series of events that will bring hope to Arelon, and perhaps reveal the secret of Elantris itself.
A rare epic fantasy that doesn't recycle the classics and that is a complete and satisfying story in one volume, Elantris is fleet and fun, full of surprises and characters to care about. It's also the wonderful debut of a welcome new star in the constellation of fantasy.","['Fantasy', 'Fiction', 'Fantasy', 'High Fantasy', 'Fantasy', 'Epic Fantasy']",https://i.gr-assets.com/images/S/compressed.photo.goodreads.com/books/1475740953l/68427._SY475_.jpg,"{'1x': ['https://m.media-amazon.com/images/I/81hX5rd0C2L._AC_UY218_.jpg', 'https://m.media-amazon.com/images/I/81hX5rd0C2L._AC_UY654_FMwebp_QL65_.jpg', 'https://m.media-amazon.com/images/I/518uuiLFQJL._AC_UY436_FMwebp_QL65_.jpg'], '1.5x': ['https://m.media-amazon.com/images/I/81hX5rd0C2L._AC_UY327_FMwebp_QL65_.jpg', 'https://m.media-amazon.com/images/I/518uuiLFQJL._AC_UY218_.jpg', 'https://m.media-amazon.com/images/I/518uuiLFQJL._AC_UY500_FMwebp_QL65_.jpg'], '2x': ['https://m.media-amazon.com/images/I/81hX5rd0C2L._AC_UY436_FMwebp_QL65_.jpg', 'https://m.media-amazon.com/images/I/518uuiLFQJL._AC_UY327_FMwebp_QL65_.jpg', 'https://m.media-amazon.com/images/I/81B5sMMgReL._AC_UY218_.jpg'], '2.5x': ['https://m.media-amazon.com/images/I/81hX5rd0C2L._AC_UY545_FMwebp_QL65_.jpg', 'https://m.media-amazon.com/images/I/81B5sMMgReL._AC_UY327_FMwebp_QL65_.jpg'], '3x': [], '3.5x': [], '4x': []}","['https://images-na.ssl-images-amazon.com/images/I/81hX5rd0C2L.jpg', 'https://images-na.ssl-images-amazon.com/images/I/518uuiLFQJL.jpg']",Tor Fantasy
Norse Mythology,Neil Gaiman,,,301,4.09,273408,2017-02-07,,,Norse Mythology,Standalone,1,https://www.goodreads.com/book/show/37903770,"Neil Gaiman, long inspired by ancient mythology in creating the fantastical realms of his fiction, presents a bravura rendition of the Norse gods and their world from their origin though their upheaval in Ragnarok.
In Norse Mythology, Gaiman stays true to the myths in envisioning the major Norse pantheon: Odin, the highest of the high, wise, daring, and cunning; Thor, Odin’s son, incredibly strong yet not the wisest of gods; and Loki—son of a giant—blood brother to Odin and a trickster and unsurpassable manipulator.
Gaiman fashions these primeval stories into a novelistic arc that begins with the genesis of the legendary nine worlds and delves into the exploits of deities, dwarfs, and giants. Through Gaiman’s deft and witty prose, these gods emerge with their fiercely competitive natures, their susceptibility to being duped and to duping others, and their tendency to let passion ignite their actions, making these long-ago myths breathe pungent life again.","['Fantasy', 'Fantasy', 'Mythology', 'Fiction', 'Audiobook', 'Short Stories']",https://i.gr-assets.com/images/S/compressed.photo.goodreads.com/books/1516128292l/37903770._SX318_.jpg,"{'1x': ['https://m.media-amazon.com/images/I/91bBWBGI5+L._AC_UY218_.jpg', 'https://m.media-amazon.com/images/I/91bBWBGI5+L._AC_UY654_FMwebp_QL65_.jpg', 'https://m.media-amazon.com/images/I/91eQdDQvwUL._AC_UY545_FMwebp_QL65_.jpg'], '1.5x': ['https://m.media-amazon.com/images/I/91bBWBGI5+L._AC_UY327_FMwebp_QL65_.jpg', 'https://m.media-amazon.com/images/I/91eQdDQvwUL._AC_UY218_.jpg', 'https://m.media-amazon.com/images/I/91eQdDQvwUL._AC_UY654_FMwebp_QL65_.jpg'], '2x': ['https://m.media-amazon.com/images/I/91bBWBGI5+L._AC_UY436_FMwebp_QL65_.jpg', 'https://m.media-amazon.com/images/I/91eQdDQvwUL._AC_UY327_FMwebp_QL65_.jpg', 'https://m.media-amazon.com/images/I/91CJ5n2FucL._AC_UY218_.jpg'], '2.5x': ['https://m.media-amazon.com/images/I/91bBWBGI5+L._AC_UY545_FMwebp_QL65_.jpg', 'https://m.media-amazon.com/images/I/91eQdDQvwUL._AC_UY436_FMwebp_QL65_.jpg', 'https://m.media-amazon.com/images/I/91CJ5n2FucL._AC_UY327_FMwebp_QL65_.jpg'], '3x': [], '3.5x': [], '4x': []}","['https://images-na.ssl-images-amazon.com/images/I/91bBWBGI5+L.jpg', 'https://images-na.ssl-images-amazon.com/images/I/91eQdDQvwUL.jpg', 'https://images-na.ssl-images-amazon.com/images/I/51pt6+Q--cS.jpg', 'https://images-na.ssl-images-amazon.com/images/I/916JgRigQHL.jpg', 'https://images-na.ssl-images-amazon.com/images/I/81d4GyvmDYL.jpg', 'https://images-na.ssl-images-amazon.com/images/I/81RA389dlDL.jpg', 'https://images-na.ssl-images-amazon.com/images/I/81czZaXwGLL.jpg', 'https://images-na.ssl-images-amazon.com/images/I/71BD0PwddUL.jpg', 'https://images-na.ssl-images-amazon.com/images/I/91N-UOuVAkL.jpg', 'https://images-na.ssl-images-amazon.com/images/I/81doMV53vsL.jpg', 'https://images-na.ssl-images-amazon.com/images/I/91DUBTDlgrL.jpg', 'https://images-na.ssl-images-amazon.com/images/I/6155wAeMe3L.jpg', 'https://images-na.ssl-images-amazon.com/images/I/91CJ5n2FucL.jpg', 'https://images-na.ssl-images-amazon.com/images/I/61+bFabUYDL.jpg', 'https://images-na.ssl-images-amazon.com/images/I/813rXMaeXbL.jpg', 'https://images-na.ssl-images-amazon.com/images/I/91PyFttVOWL.jpg', 'https://images-na.ssl-images-amazon.com/images/I/91JC1M+85ZL.jpg', 'https://images-na.ssl-images-amazon.com/images/I/91gHW6O1gyL.jpg', 'https://images-na.ssl-images-amazon.com/images/I/910GCd1aNLL.jpg']",W. W. Norton & Company
Stardust,Neil Gaiman,9780061142024.0,0061142026,248,4.09,405582,1998-01-01,,,Stardust,Standalone,1,https://www.goodreads.com/book/show/16793,"Alternate cover edition can be found here
From multi award-winning creator of ""The Sandman"", Neil Gaiman, comes the incredible work that broke new ground in graphic novel storytelling, re-issued in a deluxe hardback edition with a new cover and eight additional pages of bonus material. Together with acclaimed artist Charles Vess, Gaiman returns to the realm of Faerie for a
...more","['Fantasy', 'Fiction', 'Romance', 'Young Adult', 'Adventure']",https://i.gr-assets.com/images/S/compressed.photo.goodreads.com/books/1425763256l/25094393.jpg,"{'1x': ['https://m.media-amazon.com/images/I/712o0KZvyQL._AC_UY218_.jpg', 'https://m.media-amazon.com/images/I/712o0KZvyQL._AC_UY654_FMwebp_QL65_.jpg', 'https://m.media-amazon.com/images/I/712o0KZvyQL._AC_UY545_FMwebp_QL65_.jpg'], '1.5x': ['https://m.media-amazon.com/images/I/712o0KZvyQL._AC_UY327_FMwebp_QL65_.jpg', 'https://m.media-amazon.com/images/I/712o0KZvyQL._AC_UY218_.jpg', 'https://m.media-amazon.com/images/I/712o0KZvyQL._AC_UY654_FMwebp_QL65_.jpg'], '2x': ['https://m.media-amazon.com/images/I/712o0KZvyQL._AC_UY436_FMwebp_QL65_.jpg', 'https://m.media-amazon.com/images/I/712o0KZvyQL._AC_UY327_FMwebp_QL65_.jpg', 'https://m.media-amazon.com/images/I/9192LZdvHfL._AC_UY218_.jpg'], '2.5x': ['https://m.media-amazon.com/images/I/712o0KZvyQL._AC_UY545_FMwebp_QL65_.jpg', 'https://m.media-amazon.com/images/I/712o0KZvyQL._AC_UY436_FMwebp_QL65_.jpg', 'https://m.media-amazon.com/images/I/9192LZdvHfL._AC_UY327_FMwebp_QL65_.jpg'], '3x': [], '3.5x': [], '4x': []}","['https://images-na.ssl-images-amazon.com/images/I/712o0KZvyQL.jpg', 'https://images-na.ssl-images-amazon.com/images/I/81hBD0Ix-nL.jpg', 'https://images-na.ssl-images-amazon.com/images/I/81o2ih4e2VL.jpg', 'https://images-na.ssl-images-amazon.com/images/I/712o0KZvyQL.jpg', 'https://images-na.ssl-images-amazon.com/images/I/81hBD0Ix-nL.jpg', 'https://images-na.ssl-images-amazon.com/images/I/81o2ih4e2VL.jpg']",Harper Perennial
To Kill A Mockingbird,Harper Lee,9780333398548.0,0333398548,96,4.27,5307189,1960-07-11,,,To Kill A Mockingbird,Standalone,1,https://www.goodreads.com/book/show/2657,"The unforgettable novel of a childhood in a sleepy Southern town and the crisis of conscience that rocked it. ""To Kill A Mockingbird"" became both an instant bestseller and a critical success when it was first published in 1960. It went on to win the Pulitzer Prize in 1961 and was later made into an Academy Award-winning film, also a classic.
Compassionate, dramatic, and deeply moving, ""To Kill A Mockingbird"" takes readers to the roots of human behavior - to innocence and experience, kindness and cruelty, love and hatred, humor and pathos. Now with over 18 million copies in print and translated into forty languages, this regional story by a young Alabama woman claims universal appeal. Harper Lee always considered her book to be a simple love story. Today it is regarded as a masterpiece of American literature.","['Fiction', 'Classics', 'Historical', 'Historical Fiction', 'Academic', 'School']",https://i.gr-assets.com/images/S/compressed.photo.goodreads.com/books/1553383690l/2657.jpg,"{'1x': ['https://m.media-amazon.com/images/I/81gepf1eMqL._AC_UY218_.jpg', 'https://m.media-amazon.com/images/I/81gepf1eMqL._AC_UY654_FMwebp_QL65_.jpg', 'https://m.media-amazon.com/images/I/71i-RfGntmL._AC_UY545_FMwebp_QL65_.jpg'], '1.5x': ['https://m.media-amazon.com/images/I/81gepf1eMqL._AC_UY327_FMwebp_QL65_.jpg', 'https://m.media-amazon.com/images/I/71i-RfGntmL._AC_UY218_.jpg', 'https://m.media-amazon.com/images/I/71i-RfGntmL._AC_UY654_FMwebp_QL65_.jpg'], '2x': ['https://m.media-amazon.com/images/I/81gepf1eMqL._AC_UY436_FMwebp_QL65_.jpg', 'https://m.media-amazon.com/images/I/71i-RfGntmL._AC_UY327_FMwebp_QL65_.jpg', 'https://m.media-amazon.com/images/I/91REf0GGuiL._AC_UY218_.jpg'], '2.5x': ['https://m.media-amazon.com/images/I/81gepf1eMqL._AC_UY545_FMwebp_QL65_.jpg', 'https://m.media-amazon.com/images/I/71i-RfGntmL._AC_UY436_FMwebp_QL65_.jpg', 'https://m.media-amazon.com/images/I/91REf0GGuiL._AC_UY327_FMwebp_QL65_.jpg'], '3x': [], '3.5x': [], '4x': []}","['https://images-na.ssl-images-amazon.com/images/I/81gepf1eMqL.jpg', 'https://images-na.ssl-images-amazon.com/images/I/71tZKJuoMRL.jpg', 'https://images-na.ssl-images-amazon.com/images/I/91REf0GGuiL.jpg', 'https://images-na.ssl-images-amazon.com/images/I/819gqi50k4L.jpg', 'https://images-na.ssl-images-amazon.com/images/I/51RvlKfBI-L.jpg', 'https://images-na.ssl-images-amazon.com/images/I/512Crb+9vzL.jpg', 'https://images-na.ssl-images-amazon.com/images/I/51WPvw+eNPL.jpg']",Harper Perennial Modern Classics
"I, Robot (Robot, #0.1)",Isaac Asimov,9780553803709.0,0553803700,224,4.21,313054,1950-12-02,,,"I, Robot",Robot,0,https://www.goodreads.com/book/show/41804,"Isaac Asimov's I, Robot launches readers on an adventure into a not-so-distant future where man and machine , struggle to redefinelife, love, and consciousness—and where the stakes are nothing less than survival. Filled with unforgettable characters, mind-bending speculation, and nonstop action, I, Robot is a powerful reading experience from one of the master storytellers of our time.
I, ROBOT
They mustn't harm a human being, they must obey hitman orders, and they must protect their own existence...but only so long as that doesn't violate rules one and two. With these Three Laws of Robotics, humanity embarked on perhaps its greatest adventure: the invention of the first positronic man. It was a bold new era of evolution that would open up enormous possibilities—and unforeseen risks. For the scientists who invented the earliest robots weren't content that their creations should ' remain programmed helpers, companions, and semisentient worker-machines. And soon the robots themselves; aware of their own intelligence, power, and humanity, aren't either.
As humans and robots struggle to survive together—and sometimes against each other—on earth and in space, the future of both hangs in the balance. Human men and women confront robots gone mad, telepathic robots, robot politicians, and vast robotic intelligences that may already secretly control the world. And both are asking the same questions: What is human? And is humanity obsolete?
In l, Robot Isaac Asimov changes forever our perception of robots, and human beings and updates the timeless myth of man's dream to play god. with all its rewards—and terrors.
--front flap","['Science Fiction', 'Fiction', 'Classics', 'Short Stories', 'Science Fiction Fantasy']",https://i.gr-assets.com/images/S/compressed.photo.goodreads.com/books/1609035271l/41804.jpg,"{'1x': ['https://m.media-amazon.com/images/I/81LozjUwcUL._AC_UY218_.jpg'], '1.5x': ['https://m.media-amazon.com/images/I/81LozjUwcUL._AC_UY327_FMwebp_QL65_.jpg'], '2x': ['https://m.media-amazon.com/images/I/81LozjUwcUL._AC_UY436_FMwebp_QL65_.jpg'], '2.5x': ['https://m.media-amazon.com/images/I/81LozjUwcUL._AC_UY545_FMwebp_QL65_.jpg'], '3x': [], '3.5x': [], '4x': []}",['https://images-na.ssl-images-amazon.com/images/I/81LozjUwcUL.jpg'],Bantam Books
The Time Machine,H.G. Wells,,,118,3.9,468064,1895-05-07,,,The Time Machine,Standalone,1,https://www.goodreads.com/book/show/2493,"“I’ve had a most amazing time....”
So begins the Time Traveller’s astonishing firsthand account of his journey 800,000 years beyond his own era—and the story that launched H.G. Wells’s successful career and earned him his reputation as the father of science fiction. With a speculative leap that still fires the imagination, Wells sends his brave explorer to face a future burdened with our greatest hopes...and our darkest fears. A pull of the Time Machine’s lever propels him to the age of a slowly dying Earth.  There he discovers two bizarre races—the ethereal Eloi and the subterranean Morlocks—who not only symbolize the duality of human nature, but offer a terrifying portrait of the men of tomorrow as well.  Published in 1895, this masterpiece of invention captivated readers on the threshold of a new century. Thanks to Wells’s expert storytelling and provocative insight, The Time Machine will continue to enthrall readers for generations to come.
 ","['Classics', 'Science Fiction', 'Fiction', 'Science Fiction', 'Time Travel', 'Fantasy']",https://i.gr-assets.com/images/S/compressed.photo.goodreads.com/books/1327942880l/2493.jpg,"{'1x': ['https://m.media-amazon.com/images/I/61jnl0RwbGL._AC_UY218_.jpg', 'https://m.media-amazon.com/images/I/61jnl0RwbGL._AC_UY654_FMwebp_QL65_.jpg', 'https://m.media-amazon.com/images/I/71+n2VSAiXS._AC_UY545_FMwebp_QL65_.jpg'], '1.5x': ['https://m.media-amazon.com/images/I/61jnl0RwbGL._AC_UY327_FMwebp_QL65_.jpg', 'https://m.media-amazon.com/images/I/71+n2VSAiXS._AC_UY218_.jpg', 'https://m.media-amazon.com/images/I/71+n2VSAiXS._AC_UY654_FMwebp_QL65_.jpg'], '2x': ['https://m.media-amazon.com/images/I/61jnl0RwbGL._AC_UY436_FMwebp_QL65_.jpg', 'https://m.media-amazon.com/images/I/71+n2VSAiXS._AC_UY327_FMwebp_QL65_.jpg', 'https://m.media-amazon.com/images/I/7149RLMXbhL._AC_UY218_.jpg'], '2.5x': ['https://m.media-amazon.com/images/I/61jnl0RwbGL._AC_UY545_FMwebp_QL65_.jpg', 'https://m.media-amazon.com/images/I/71+n2VSAiXS._AC_UY436_FMwebp_QL65_.jpg', 'https://m.media-amazon.com/images/I/7149RLMXbhL._AC_UY327_FMwebp_QL65_.jpg'], '3x': [], '3.5x': [], '4x': []}","['https://images-na.ssl-images-amazon.com/images/I/61jnl0RwbGL.jpg', 'https://images-na.ssl-images-amazon.com/images/I/712JzWenugL.jpg', 'https://images-na.ssl-images-amazon.com/images/I/71+n2VSAiXS.jpg', 'https://images-na.ssl-images-amazon.com/images/I/710V6YbQzLL.jpg', 'https://images-na.ssl-images-amazon.com/images/I/91ekGwy1JaL.jpg', 'https://images-na.ssl-images-amazon.com/images/I/91EDZeSbeAL.jpg', 'https://images-na.ssl-images-amazon.com/images/I/91-IfFBsTqL.jpg', 'https://images-na.ssl-images-amazon.com/images/I/81G7SWaMNbL.jpg', 'https://images-na.ssl-images-amazon.com/images/I/812WwOWN7aL.jpg', 'https://images-na.ssl-images-amazon.com/images/I/81cXR1DIDaL.jpg', 'https://images-na.ssl-images-amazon.com/images/I/7149RLMXbhL.jpg', 'https://images-na.ssl-images-amazon.com/images/I/71A9R3bmSbL.jpg', 'https://images-na.ssl-images-amazon.com/images/I/81YKs0MwDWL.jpg', 'https://images-na.ssl-images-amazon.com/images/I/817ig+IzNtL.jpg', 'https://images-na.ssl-images-amazon.com/images/I/71nEa0UCR4L.jpg', 'https://images-na.ssl-images-amazon.com/images/I/81pdhGC8gGL.jpg', 'https://images-na.ssl-images-amazon.com/images/I/71i6iv-xodL.jpg', 'https://images-na.ssl-images-amazon.com/images/I/81mRcM8HmsL.jpg']",Signet Classics
"The Hobbit, Part One",J.R.R. Tolkien,9780007926664.0,,230,4.3,373652,1937-09-21,,,"The Hobbit, Part One",Standalone,1,https://www.goodreads.com/book/show/17157681,"Smaug certainly looked fast asleep, when Bilbo peeped once more from the entrance. He was just about to step out onto the floor when he caught a sudden thin ray of red from under the drooping lid of Smaug's left eye. He was only pretending to be sleep! He was watching the tunnel entrance!
Whisked from his comfortable hobbit-hole by Gandalf the wizard and a band of dwarves, Bilbo Baggins finds himself caught up in a plot to raid the treasure hoard of Smaug the Magnificent, a large and very dangerous dragon.","['Fantasy', 'Fiction', 'Classics', 'Adventure', 'Science Fiction Fantasy']",https://i.gr-assets.com/images/S/compressed.photo.goodreads.com/books/1371834025l/17157681.jpg,"{'1x': ['https://m.media-amazon.com/images/I/516xUMa9KuL._AC_UY218_.jpg'], '1.5x': ['https://m.media-amazon.com/images/I/516xUMa9KuL._AC_UY327_FMwebp_QL65_.jpg'], '2x': ['https://m.media-amazon.com/images/I/516xUMa9KuL._AC_UY436_FMwebp_QL65_.jpg'], '2.5x': ['https://m.media-amazon.com/images/I/516xUMa9KuL._AC_UY545_FMwebp_QL65_.jpg'], '3x': [], '3.5x': [], '4x': []}",['https://images-na.ssl-images-amazon.com/images/I/516xUMa9KuL.jpg'],HarperCollins Children's Books
